Command: sudo tcpdump -i any -c 5
Output:
23:03:33.794758 lo    In  IP 10.255.255.254.50227 > 10.255.255.254.domain: 7190+ A? example.com. (29)
23:03:33.794808 lo    In  IP 10.255.255.254.50227 > 10.255.255.254.domain: 51476+ AAAA? example.com. (29)
23:03:33.800510 lo    In  IP 10.255.255.254.domain > 10.255.255.254.50227: 51476 NXDomain 0/0/0 (29)
23:03:33.800564 lo    In  IP 10.255.255.254.domain > 10.255.255.254.50227: 7190 NXDomain 0/0/0 (29)
23:03:33.800988 lo    In  IP 10.255.255.254.43090 > 10.255.255.254.domain: 32086+ A? example.com.home. (34)
