Command: sudo tcpdump -i any udp -c 5
Output:
23:12:18.664116 lo    In  IP 10.255.255.254.52919 > 10.255.255.254.domain: 40497+ A? google.com. (28)
23:12:18.669263 lo    In  IP 10.255.255.254.domain > 10.255.255.254.52919: 40497 6/0/0 A 142.250.137.102, A 142.250.137.100, A 142.250.137.101, A 142.250.137.138, A 142.250.137.139, A 142.250.137.113 (124)
23:12:18.671054 lo    In  IP 10.255.255.254.48126 > 10.255.255.254.domain: 4946+ AAAA? google.com. (28)
23:12:18.673964 lo    In  IP 10.255.255.254.domain > 10.255.255.254.48126: 4946 4/0/0 AAAA 2607:f8b0:4023:1804::65, AAAA 2607:f8b0:4023:1804::66, AAAA 2607:f8b0:4023:1804::8b, AAAA 2607:f8b0:4023:1804::71 (140)
23:12:18.877404 lo    In  IP 10.255.255.254.40155 > 10.255.255.254.domain: 47032+ PTR? 254.255.255.10.in-addr.arpa. (45)
